{
  "record_id": "REPLACE-unique-record-id",
  "candidate_id": "REPLACE-candidate-id",
  "recorded_at": null,
  "status": "RESEARCH",
  "supersedes_record_id": null,
  "source": {
    "type": "audit",
    "locator": "docs/supplied-audit.md#6-open-questions-for-you",
    "published_at": null,
    "captured_at": "2026-10-23",
    "timestamp_or_message_id": null,
    "paraphrase": null,
    "public_safe": true
  },
  "baseline_version": "saty-sig-2.0",
  "baseline_commit": null,
  "hypothesis": null,
  "rule_delta": null,
  "rationale": null,
  "primary_metric": null,
  "minimum_effect": null,
  "guardrails": [],
  "data_requirements": [],
  "training_interval": null,
  "untouched_evaluation_interval": null,
  "episode_definition": null,
  "overlap_policy": null,
  "exclusion_rules": [],
  "inference_plan": null,
  "review_date": null,
  "candidate_code_commit": null,
  "decision": null
}
